{
  "report_date": "2026-05-26",
  "summary": "线上自动化生成：扫描候选 45 条、可解析游戏 0 条；新增推进池 0 条、观察池 0 条、淘汰池 0 条。",
  "insights": [
    "日报已切到 GitHub Actions 线上生成，不依赖本地电脑开机或 Codex 桌面任务。",
    "Steam 搜索页抓取失败时会自动退到 Steam 官方 featured categories，避免趋势和日报整天开天窗。",
    "推进池只代表值得优先触达的候选；真正进入深度推进仍需要你人工确认团队地区、窗口和发行占位。",
    "联系方式优先取 Steam support email、官网、官网邮件和社媒；没有明确入口时保留 Steam 社区作为兜底。"
  ],
  "push_pool": [],
  "watch_pool": [],
  "drop_pool": []
}
