{
  "report_date": "2026-07-15",
  "summary": "Sourcing V6.8 质量隔离：扫描 Steam 候选 251 条、富化 90 条，另从国内媒体/B站提取产品线索 5 条；B站探头候选 131 条、最终 43 条、官方源命中 0 条；日报正式 Lead 池暂时为空，扫描结果仅用于 Radar、Steam Trends 与质量诊断。",
  "insights": [
    "V6.8质量隔离继续面向B站商务负责人生成日报、Radar与Steam Trends，但暂不发布正式Lead。",
    "每个可review项目必须说明玩法循环、公开数据、优势、短板、B站内容/社区赋能方式和下一步测试/BD动作。",
    "国内媒体和B站捕捉到的具体产品继续参与扫描与证据校验；质量隔离期间不进入正式Lead池。",
    "行业雷达必须来自真实媒体、厂商、法院/公司公告或可核验社区信号，不能用内部规则说明冒充行业新闻。",
    "Steam趋势必须输出大盘观察：近期冒头品类、活动/窗口、发行商新品、数据样本和BD含义，不能把日报规则贴到趋势页。",
    "Demo/试玩只能证明可测试，不能覆盖合作窗口；距发售不足60天的新线索默认淘汰或作为市场背景。",
    "B站视频线索通过探头配置优先扫描官方号/开发者号/发行商号，补读简介，提取Steam/官网/联系方式，交叉验证是否已发售，并和历史CRM记录去重。",
    "B站/媒体字段必须保持决策台可读：Steam链接写入links，玩法写标签，进度写短状态，下一步动作和备注默认留给人工。",
    "海外项目默认不占用BD复核名额，除非具备PC数据验证且能说清手游化/移动端改编角度。",
    "已发售、EA、叙事主导、印度团队、成熟发行商占位的项目不再进入人工复核候选。",
    "有效lead必须回答三件事：窗口是否还在、权益空间是否还在、B站是否能把中国区盘子做大。",
    "自动日报在质量隔离期间只负责发现与诊断，不向观察池/待评测/跟进池/推进池发布项目。",
    "质量隔离期间正式Lead为0既不失败也不标记degraded；来源扫描异常、结构损坏、写入失败或同步失败仍然阻断。"
  ],
  "push_pool": [],
  "watch_pool": [],
  "drop_pool": []
}
